{
  "$schema": "https://json-schema.org/draft/2020-12/schema",
  "$id": "https://github.com/miaoti/MIST/debug/a-main/benchmark/schema/fault-case.schema.json",
  "title": "MIST labeled fault-case (C2 benchmark) — rev 2",
  "description": "One labeled case in the MIST open-source benchmark of masked-downstream / acked-but-lost data-integrity faults. REV 2: brought into lockstep with debug/a-main/c2c3/c2-freeze.md (step-1 re-freeze, R1-R8). A case records the target write, the typed durable read-back, the fault + its clean twin, the ground-truth label, per-oracle EXPECTED verdicts (baseline columns deterministic; mist_* columns are TARGETS measured at eval, never ground truth), and the visibility axes (trace + ack-content). An oracle is CORRECT on a case iff its actual verdict matches its oracle_expectation entry, which for baseline columns equals (verdict==flag)==(label==positive). Supersedes schema v0.1.0 (see README migration map).",
  "type": "object",
  "additionalProperties": false,
  "required": [
    "case_id",
    "schema_version",
    "stratum",
    "capture_status",
    "fault_class",
    "sut",
    "target",
    "fault",
    "stimulus",
    "oracle_eval",
    "ground_truth",
    "oracle_expectation",
    "provenance"
  ],
  "properties": {
    "case_id": { "type": "string", "pattern": "^[A-Za-z0-9][A-Za-z0-9._-]*$" },
    "schema_version": { "type": "string", "pattern": "^\\d+\\.\\d+\\.\\d+$", "description": "2.0.0 for this re-freeze." },
    "stratum": {
      "type": "integer",
      "enum": [1, 2, 3],
      "description": "1 = positive by construction (injected/replicated/vendor/natural). 2 = benign trap (label=negative, by-docs). 3 = adjudicated wild (label by raters; may be underspecified)."
    },
    "capture_status": {
      "type": "string",
      "enum": ["specified", "captured"],
      "description": "specified = designed, label known, traces/read-back not yet recorded. captured = control/fault traces + read-back recorded on a live deploy."
    },
    "fault_class": {
      "type": "string",
      "enum": ["acknowledged_lost_write", "acknowledged_corrupted_write", "missing_compensation", "swallowed_downstream_error", "none"],
      "description": "Surface phenomenon (NOT the verdict). none = clean control / benign. acknowledged_corrupted_write = 2xx-acked write persists PRESENT-BUT-WRONG durable state (A3 F-corpus class; MIST read-back oracle = not_applicable out-of-scope-by-design)."
    },
    "readback_shape": {
      "type": "string",
      "enum": ["present-landed", "absent-lost", "partial-aggregate-loss", "eventual-present", "reject-no-delta", "reject-absent-empty", "degraded-present"],
      "description": "R1d/§8: OPTIONAL structured render-shape of the durable read-back, so the shape-polarity census (SUT x shape x provenance) is mechanically computable rather than free-text. Populated on NEGATIVES (the benign census): present-landed = clean write lands (control/clean-twin); eventual-present = absent at cap then heals PRESENT at re-probe (bounded eventual consistency; MIST single-shot timeout FPs by construction); reject-no-delta = by-design 2xx no-persist/no-change rendering present-unchanged or zero-delta, disambiguated by a body-tell (status:0) OR a same-with-same norm (dedupe / no-op-modify); reject-absent-empty = fresh-key soft-reject that renders EMPTY like a genuine loss (the presence-defuser shape; structurally near-unreachable per r1d-phase0-findings.md — 0 today, enum reserved); degraded-present = designed graceful degradation / optional-dependency-down 2xx (swallowed_downstream_error). POSITIVES omit this field — their shape is fault_class-derived (acknowledged_lost_write=absent-lost; the parent-landed/child-lost meshsever=partial-aggregate-loss)."
    },
    "sut": {
      "type": "object",
      "additionalProperties": false,
      "required": ["name"],
      "properties": {
        "name": { "type": "string", "enum": ["trainticket", "sockshop", "teastore", "oteldemo", "boutique", "bookinfo"] },
        "repo": { "type": "string" },
        "branch": { "type": "string" },
        "commit": { "type": "string" },
        "image_digest": { "type": "string", "description": "sha256:...; the label is bound to this digest (label.version_validity)." },
        "deploy": { "type": "string" },
        "replay_script": { "type": "string" },
        "health_precondition": { "type": ["string", "null"], "description": "Pre-flight checklist path (pods Ready, endpoints 200, mesh/broker state)." }
      }
    },
    "target": {
      "type": "object",
      "additionalProperties": false,
      "required": ["entry_endpoint", "dependency", "readback"],
      "properties": {
        "entry_endpoint": { "$ref": "#/$defs/endpoint" },
        "dependency": {
          "type": "object",
          "additionalProperties": false,
          "required": ["service", "kind"],
          "properties": {
            "service": { "type": "string" },
            "kind": { "type": "string", "enum": ["persistence", "downstream_service", "broker", "external"] }
          }
        },
        "readback": {
          "type": "object",
          "additionalProperties": false,
          "description": "R4/B-B4: TYPED, oracle-agnostic durable observable. Replaces the old prose observable + optional readback_endpoint.",
          "required": ["modality", "expect_without_fault", "expect_with_fault", "mist_bindable"],
          "properties": {
            "modality": { "type": "string", "enum": ["api-get", "sql-probe", "broker-count", "trace-span-presence", "none-durable"] },
            "locator": { "type": ["string", "null"], "description": "endpoint path | SQL | queue name | span selector | null." },
            "expect_without_fault": { "type": "string", "enum": ["present", "landed", "count-delta-positive", "span-present"] },
            "expect_with_fault": { "type": "string", "enum": ["absent", "not-landed", "count-delta-zero", "span-absent", "present-wrong-value"] },
            "mist_bindable": { "type": "boolean", "description": "Can MIST's oracle bind this modality? sql-probe / none-durable may be false." }
          }
        }
      }
    },
    "fault": {
      "type": "object",
      "additionalProperties": false,
      "required": ["mechanism", "injection_method", "provenance_class"],
      "properties": {
        "mechanism": {
          "type": "string",
          "enum": ["flag", "mesh-sever", "broker-policy", "dependency-down", "code-level", "none"],
          "description": "R1: the fault-MECHANISM diversity class (what the >=4-per-write-path-SUT floor counts). flag = app/runtime/vendor feature toggle; dependency-down = DB/backing-store kill; none = clean/benign. An input-driven variant is a STIMULUS (stimulus.workload_variant), NOT a mechanism, and does NOT count toward diversity."
        },
        "injection_method": {
          "type": "string",
          "enum": ["natural", "vendor_flag", "sut_injector", "toxiproxy", "mesh_abort", "broker_policy", "dependency_scale_zero", "replicated_fault", "none"],
          "description": "HOW the mechanism is produced (was injection.mechanism in v0.1.0). natural = an unmodified designed-degradation path (no injection)."
        },
        "config": { "type": "object", "description": "Reproducible knobs. Free-form." },
        "injected_by": { "type": "string" },
        "target_service": { "type": "string" },
        "provenance_class": { "type": "string", "enum": ["by-injection", "by-docs", "by-adjudication"] }
      }
    },
    "negative_control": {
      "type": "object",
      "additionalProperties": false,
      "required": ["present"],
      "properties": {
        "present": { "type": "boolean", "description": "Every S1 case MUST have one. The oracle's negative test: not-firing => TN, firing => FP." },
        "replay_script": { "type": ["string", "null"] }
      }
    },
    "stimulus": {
      "type": "object",
      "additionalProperties": false,
      "required": ["write_path"],
      "properties": {
        "script": { "type": "string" },
        "write_path": { "type": "boolean" },
        "workload_class": { "type": "string", "enum": ["authored-scenario", "builtin-loadgen", "scripted-browse", "none"] },
        "workload_variant": { "type": ["string", "null"], "description": "R1: input-driven variants live here (e.g. bogus-user-id), not as a mechanism." }
      }
    },
    "oracle_eval": {
      "type": "object",
      "additionalProperties": false,
      "required": ["ack_content_visibility", "trace_visibility", "write_shape"],
      "properties": {
        "ack_content_visibility": {
          "type": "string",
          "enum": ["success-shaped-clean", "sentinel-in-body", "status-field-tells"],
          "description": "R8/C-A2: does the 2xx ack itself carry a machine-readable tell? Non-clean => tell-bearing => segregated from the primary discriminating positive denominator."
        },
        "trace_visibility": {
          "type": "string",
          "enum": ["error-span-visible", "span-presence-visible", "trace-invisible-by-construction", "trace-uninstrumented"],
          "description": "B-M5: by-construction invisibility (fabricated-ack/normal span) is kept separate from tooling-contingent (un-instrumented, e.g. TeaStore-Kieker-exclude)."
        },
        "write_shape": { "type": "string", "enum": ["whole", "partial-aggregate", "transition"], "description": "B-M7: parent-landed/child-lost etc." },
        "oracle_mode": { "type": "string", "enum": ["observe", "paired"], "description": "U7: which MIST mode produced this case's verdict. observe = product single-leg; paired = eval harness." },
        "config_provenance": {
          "type": "object",
          "additionalProperties": false,
          "properties": {
            "mist_properties": { "type": "string" },
            "triples": { "type": ["string", "null"] },
            "timeout_caps": { "type": "string" },
            "mist_commit": { "type": "string", "description": "ONE frozen study-wide commit; IDENTICAL across every case. Pinned at the END of the 1.9 UX wave (criteria incl. W0-W6; QuiescenceGate->verdict mapping frozen at the pin)." },
            "mist_authoring": {
              "type": "object",
              "additionalProperties": false,
              "description": "U7: MIST's side of the authoring-cost symmetry. Unit = minutes per bound endpoint (same unit as comparator authoring_cost).",
              "properties": {
                "tier": { "type": "string", "enum": ["proposed-accepted", "hand-written", "expert"] },
                "minutes": { "type": "integer" }
              }
            }
          }
        },
        "comparator_configs": {
          "type": "array",
          "items": {
            "type": "object",
            "additionalProperties": false,
            "required": ["arm"],
            "properties": {
              "arm": { "type": "string", "enum": ["naive", "tracetest-error", "tracetest-presence", "traceanomaly", "contract-invariant"] },
              "config": { "type": "string" },
              "authoring_cost": {
                "type": "object",
                "additionalProperties": false,
                "description": "B-M4: the arm-3 automation-gap datum.",
                "properties": { "minutes": { "type": "integer" }, "endpoints_covered": { "type": "integer" }, "notes": { "type": "string" } }
              }
            }
          }
        }
      }
    },
    "ground_truth": {
      "type": "object",
      "additionalProperties": false,
      "required": ["label", "rationale", "source"],
      "properties": {
        "label": {
          "type": "string",
          "enum": ["positive", "negative", "underspecified"],
          "description": "positive == rubric 'genuine'; negative == 'benign'; underspecified is STRATUM-3 ONLY (norm not derivable from docs/spec/source) and is excluded from the primary precision denominator."
        },
        "rationale": { "type": "string", "description": "Observation (from the case's presented state, admissible) + the NORM (from docs/spec/source only) per rubric.md. Traces/tool-output are NOT the source of the norm." },
        "source": { "type": "string", "enum": ["by_construction", "replicated", "vendor", "adjudicated", "natural"] },
        "version": { "type": "integer", "description": "label-version; bound to sut.image_digest." },
        "doc_citation": { "type": ["string", "null"], "description": "by-docs labels cite the doc version." }
      }
    },
    "oracle_expectation": {
      "type": "object",
      "additionalProperties": false,
      "description": "Per-oracle EXPECTED verdict. Baseline columns are deterministic by construction; mist_* columns are TARGETS measured at eval (never ground truth). body_marker_oracle flags iff oracle_eval.ack_content_visibility != success-shaped-clean.",
      "required": ["status_code_oracle", "schema_oracle", "body_marker_oracle", "naive_span_error_oracle", "tracetest_presence_oracle", "mist_readback_oracle", "mist_trace_shape_oracle"],
      "properties": {
        "status_code_oracle": { "$ref": "#/$defs/verdict" },
        "schema_oracle": { "$ref": "#/$defs/verdict" },
        "body_marker_oracle": { "$ref": "#/$defs/verdict" },
        "naive_span_error_oracle": { "$ref": "#/$defs/verdict" },
        "tracetest_presence_oracle": { "$ref": "#/$defs/verdict" },
        "mist_readback_oracle": { "$ref": "#/$defs/verdict" },
        "mist_trace_shape_oracle": { "$ref": "#/$defs/verdict" }
      }
    },
    "provenance": {
      "type": "object",
      "additionalProperties": false,
      "required": ["notes"],
      "properties": {
        "control_trace": { "type": ["string", "null"] },
        "fault_trace": { "type": ["string", "null"] },
        "readback_response": { "type": ["string", "null"] },
        "notes": { "type": "string" }
      }
    },
    "license": {
      "type": "object",
      "additionalProperties": false,
      "properties": {
        "case_code": { "type": "string" },
        "case_data": { "type": "string" },
        "upstream_sut": { "type": "string" },
        "sources": { "type": "array", "items": { "type": "string" } }
      }
    },
    "adjudication": {
      "type": ["object", "null"],
      "additionalProperties": false,
      "description": "Stratum-3 only. null for strata 1-2.",
      "required": ["raters", "kappa", "rubric_version"],
      "properties": {
        "raters": { "type": "integer", "minimum": 2 },
        "kappa": { "type": "number", "minimum": -1, "maximum": 1, "description": "S3-only kappa is the PRIMARY reliability statistic (R7)." },
        "adjudicator": { "type": "string" },
        "rubric_version": { "type": "string" }
      }
    }
  },
  "allOf": [
    {
      "if": { "properties": { "fault_class": { "enum": ["acknowledged_lost_write", "missing_compensation"] } } },
      "then": { "properties": { "target": { "properties": { "readback": { "properties": { "modality": { "not": { "const": "none-durable" } } } } } } } }
    },
    {
      "if": { "properties": { "target": { "properties": { "readback": { "properties": { "modality": { "const": "none-durable" } } } } } } },
      "then": { "properties": { "oracle_expectation": { "properties": { "mist_readback_oracle": { "const": "not_applicable" } } } } }
    },
    {
      "if": { "properties": { "ground_truth": { "properties": { "label": { "const": "underspecified" } } } } },
      "then": { "properties": { "stratum": { "const": 3 } } }
    },
    {
      "if": { "properties": { "stratum": { "const": 3 } } },
      "then": { "required": ["adjudication"], "properties": { "adjudication": { "type": "object" } } }
    }
  ],
  "$defs": {
    "endpoint": {
      "type": "object",
      "additionalProperties": false,
      "required": ["method", "path", "service"],
      "properties": {
        "method": { "type": "string", "enum": ["GET", "POST", "PUT", "DELETE", "PATCH"] },
        "path": { "type": "string" },
        "service": { "type": "string" }
      }
    },
    "verdict": {
      "type": "string",
      "enum": ["flag", "no_flag", "not_applicable"]
    }
  }
}
